ID,Category,Question,Answer,Url,Created,Modified
1,アカウント管理,パスワードを忘れた場合はどうすればよいですか？,パスワードをリセットするには、ログイン画面の「パスワードを忘れた場合」リンクをクリックし、指示に従ってください。,https://www.example.com#faq-1,2024/01/15,2024/08/22
2,アカウント管理,アカウントがロックされた場合の対処方法は？,アカウントがロックされた場合は、ITヘルプデスクに連絡してロック解除の手続きを行ってください。,https://www.example.com#faq-2,2024/03/10,2024/07/05
3,ソフトウェア,新しいソフトウェアをインストールするにはどうすればよいですか？,新しいソフトウェアのインストールは、ITヘルプデスクにリクエストを提出し、承認を得てから行ってください。,https://www.example.com#faq-3,2024/02/25,2024/06/18
4,ソフトウェア,ソフトウェアのアップデートができない場合の対処方法は？,ソフトウェアのアップデートができない場合は、インターネット接続を確認し、再試行してください。それでも解決しない場合は、ITヘルプデスクに連絡してください。,https://www.example.com#faq-4,2024/04/12,2024/09/01
5,ハードウェア,プリンターが動作しない場合の対処方法は？,プリンターが動作しない場合は、電源と接続を確認し、再起動してください。それでも解決しない場合は、ITヘルプデスクに連絡してください。,https://www.example.com#faq-5,2024/05/20,2024/08/10
6,ハードウェア,新しいハードウェアを接続するにはどうすればよいですか？,新しいハードウェアの接続は、ITヘルプデスクにリクエストを提出し、承認を得てから行ってください。,https://www.example.com#faq-6,2024/01/30,2024/07/15
7,ネットワーク,Wi-Fiに接続できない場合の対処方法は？,Wi-Fiに接続できない場合は、ルーターを再起動し、接続設定を確認してください。それでも解決しない場合は、ITヘルプデスクに連絡してください。,https://www.example.com#faq-7,2024/03/05,2024/06/25
8,ネットワーク,VPNに接続する方法は？,VPNに接続するには、提供されたVPNクライアントソフトウェアをインストールし、指示に従って設定を行ってください。,https://www.example.com#faq-8,2024/02/14,2024/08/30
9,セキュリティ,フィッシングメールを受け取った場合の対処方法は？,フィッシングメールを受け取った場合は、リンクをクリックせず、ITヘルプデスクに報告してください。,https://www.example.com#faq-9,2024/04/01,2024/09/10
10,セキュリティ,ウイルスに感染した場合の対処方法は？,ウイルスに感染した場合は、ネットワークから切断し、ITヘルプデスクに連絡して指示を仰いでください。,https://www.example.com#faq-10,2024/05/08,2024/07/20
